{
  "Name": "MyGameFleet",
  "Description": "Example game fleet for multiplayer sessions",
  "GameSessionQueueArns": "arn:aws:gamelift:us-east-1:123456789012:fleet/fleet-1a2b3c4d",
  "RequestTimeoutSeconds": "example-RequestTimeoutSecond",
  "AcceptanceTimeoutSeconds": "example-AcceptanceTimeoutSec",
  "AcceptanceRequired": "example-AcceptanceRequired",
  "RuleSetName": "MyGameFleet",
  "NotificationTarget": "example-NotificationTarget",
  "AdditionalPlayerCount": 10,
  "CustomEventData": "example-CustomEventData"
}